{"componentChunkName":"component---src-templates-blog-post-js","path":"/will-vietnam-cold-rolled-steel-be-taxed-when-facing-dumping-charges-in-pakistan","result":{"data":{"mdx":{"body":"function _extends() { _extends = Object.assign || function (target) { for (var i = 1; i < arguments.length; i++) { var source = arguments[i]; for (var key in source) { if (Object.prototype.hasOwnProperty.call(source, key)) { target[key] = source[key]; } } } return target; }; return _extends.apply(this, arguments); }\n\nfunction _objectWithoutProperties(source, excluded) { if (source == null) return {}; var target = _objectWithoutPropertiesLoose(source, excluded); var key, i; if (Object.getOwnPropertySymbols) { var sourceSymbolKeys = Object.getOwnPropertySymbols(source); for (i = 0; i < sourceSymbolKeys.length; i++) { key = sourceSymbolKeys[i]; if (excluded.indexOf(key) >= 0) continue; if (!Object.prototype.propertyIsEnumerable.call(source, key)) continue; target[key] = source[key]; } } return target; }\n\nfunction _objectWithoutPropertiesLoose(source, excluded) { if (source == null) return {}; var target = {}; var sourceKeys = Object.keys(source); var key, i; for (i = 0; i < sourceKeys.length; i++) { key = sourceKeys[i]; if (excluded.indexOf(key) >= 0) continue; target[key] = source[key]; } return target; }\n\n/* @jsx mdx */\nvar _frontmatter = {\n  \"template\": \"en\",\n  \"title\": \"Will Vietnam cold rolled steel be taxed when facing dumping charges in Pakistan?\",\n  \"subtitle\": \"According to the Vietnam Trade Office in Pakistan, the National Tariffs Committee of Pakistan initiated the anti-dumping investigation on some cold rolled steel products originating from/exporting from Vietnam and China, The European Union (EU) and the Republic of Korea.\",\n  \"feature_img\": \"https://static.chinhdaisteel.com/blog/10-03-2021/VN+Cold+rolled+steel.png\",\n  \"date\": \"2021-03-10T00:00:00.000Z\",\n  \"slug\": \"/will-vietnam-cold-rolled-steel-be-taxed-when-facing-dumping-charges-in-pakistan\",\n  \"category\": \"Steel Industry News\",\n  \"description\": \"Recently, Vietnam cold rolled steel is facing dumping charges in Pakistan, which leads to a question that will it be taxed. Click for more information.  \",\n  \"title_meta\": \"Will Vietnam cold rolled steel be taxed when facing dumping charges in Pakistan? - Chinh Dai Steel\",\n  \"keyword\": \"cold rolled steel\"\n};\n\nvar makeShortcode = function makeShortcode(name) {\n  return function MDXDefaultShortcode(props) {\n    console.warn(\"Component \" + name + \" was not imported, exported, or provided by MDXProvider as global scope\");\n    return mdx(\"div\", props);\n  };\n};\n\nvar layoutProps = {\n  _frontmatter: _frontmatter\n};\nvar MDXLayout = \"wrapper\";\nreturn function MDXContent(_ref) {\n  var components = _ref.components,\n      props = _objectWithoutProperties(_ref, [\"components\"]);\n\n  return mdx(MDXLayout, _extends({}, layoutProps, props, {\n    components: components,\n    mdxType: \"MDXLayout\"\n  }), mdx(\"div\", {\n    style: {\n      \"display\": \"flex\",\n      \"flexDirection\": \"column\",\n      \"alignItems\": \"center\"\n    }\n  }, mdx(\"img\", {\n    src: \"https://static.chinhdaisteel.com/blog/10-03-2021/VN+Cold+rolled+steel.png\",\n    width: \"100%\",\n    alt: \"\"\n  })), mdx(\"p\", null, mdx(\"strong\", {\n    parentName: \"p\"\n  }, mdx(\"em\", {\n    parentName: \"strong\"\n  }, \"According to the Vietnam Trade Office in Pakistan, the National Tariffs Committee of Pakistan initiated the anti-dumping investigation on some cold-rolled steel products originating from/exporting from Vietnam and China, The European Union (EU) and the Republic of Korea.\"))), mdx(\"h2\", null, \"1. Vietnam cold-rolled steels face dumping charges in Pakistan\"), mdx(\"p\", null, \"Specifically, the goods under investigation are cold-rolled steel coils and sheets which are classified according to the customs codes of Pakistan: 7209.1510, 7209.1590, 7209.1610, 7209.1690. 7209.1710, 7209.1790, 7209.1810, 7209.1891, 7209.1899, 7209.2510, 7209.2590, 7209.2610, 7209.2690, 7209.2710, 7209.2790, 7209.2810 and 7209.2890.\"), mdx(\"p\", null, \"The Vietnamese enterprise sued by the Pakistani side is China Steel & Nippon Steel Vietnam Joint Stock Company (CSVC), with the alleged dumping tax rate against Vietnamese enterprises at 27.98%.\"), mdx(\"h2\", null, \"2. What the parties involved should do?\\xA0\"), mdx(\"p\", null, \"To register as a related party in the case, the parties involved must present themselves to the investigating agency, the National Tariffs Committee of Pakistan, within 10 days of the initiation of an anti-dumping investigation, i.e. February 25, 2021. The deadline to answer the questionnaire and submit information and comments within 45 days from the date of initiation.\"), mdx(\"p\", null, \"Accordingly, the National Tariffs Committee of Pakistan will issue a preliminary conclusion within 60-180 days after initiating the case and issue a final conclusion within 180 days from the date of issuance of the preliminary conclusion.\"), mdx(\"p\", null, \"Concerning the case, the Trade Defense Department, the Ministry of Industry and Trade argued that any action that exhibited inadequate cooperation or cooperation could lead to Pakistani investigative authorities using the available evidence, disadvantage or apply the highest anti-dumping tax rate proposed by the plaintiff. The imposition of high anti-dumping duties will reduce competitive advantage, risk losing part or all of the export market to Pakistan's domestic manufacturing industry and competitors from other countries.\"), mdx(\"p\", null, \"Therefore, associations and related cold-rolled steel producers and exporters need to quickly report to the Investigation Agency and participate in full cooperation, answer the questionnaire to enjoy their own tax rate.\\xA0\"), mdx(\"p\", null, \"In addition, the Trade Defense Department also recommends that enterprises regularly coordinate and exchange information with Pakistani importers to raise their voice with the Pakistani Government, and request the Investigation Agency to seriously consider social and economic benefits and consumer interests.\\xA0\"), mdx(\"p\", null, \"At the same time, regularly consult with the Trade Defense Department to receive timely support.\"), mdx(\"p\", {\n    style: {\n      \"fontStyle\": \"italic\",\n      \"textAlign\": \"right\"\n    }\n  }, \" Source: congthuong.vn\"));\n}\n;\nMDXContent.isMDXComponent = true;","frontmatter":{"category":"Steel Industry News","slug":"/will-vietnam-cold-rolled-steel-be-taxed-when-facing-dumping-charges-in-pakistan","title":"Will Vietnam cold rolled steel be taxed when facing dumping charges in Pakistan?","title_meta":"Will Vietnam cold rolled steel be taxed when facing dumping charges in Pakistan? - Chinh Dai Steel","description":"Recently, Vietnam cold rolled steel is facing dumping charges in Pakistan, which leads to a question that will it be taxed. Click for more information.  ","keyword":"cold rolled steel"}}},"pageContext":{"slug":"/will-vietnam-cold-rolled-steel-be-taxed-when-facing-dumping-charges-in-pakistan"}},"staticQueryHashes":[]}