{"componentChunkName":"component---src-templates-products-en-js","path":"/en/galvanized-steel-pipes","result":{"data":{"mdx":{"body":"function _extends() { _extends = Object.assign || function (target) { for (var i = 1; i < arguments.length; i++) { var source = arguments[i]; for (var key in source) { if (Object.prototype.hasOwnProperty.call(source, key)) { target[key] = source[key]; } } } return target; }; return _extends.apply(this, arguments); }\n\nfunction _objectWithoutProperties(source, excluded) { if (source == null) return {}; var target = _objectWithoutPropertiesLoose(source, excluded); var key, i; if (Object.getOwnPropertySymbols) { var sourceSymbolKeys = Object.getOwnPropertySymbols(source); for (i = 0; i < sourceSymbolKeys.length; i++) { key = sourceSymbolKeys[i]; if (excluded.indexOf(key) >= 0) continue; if (!Object.prototype.propertyIsEnumerable.call(source, key)) continue; target[key] = source[key]; } } return target; }\n\nfunction _objectWithoutPropertiesLoose(source, excluded) { if (source == null) return {}; var target = {}; var sourceKeys = Object.keys(source); var key, i; for (i = 0; i < sourceKeys.length; i++) { key = sourceKeys[i]; if (excluded.indexOf(key) >= 0) continue; target[key] = source[key]; } return target; }\n\n/* @jsx mdx */\nvar _frontmatter = {\n  \"template\": \"products\",\n  \"title\": \"Galvanized Steel Pipes\",\n  \"subtitle\": \"The surface is specially treated with a chemical protective layer imported from India, so that the products have outstanding characteristics\",\n  \"feature_img\": \"https://static.chinhdaisteel.com/products/galvanized-steel-pipes.webp\",\n  \"date\": \"2020-11-02T00:00:00.000Z\",\n  \"slug\": \"/en/galvanized-steel-pipes\",\n  \"category\": \" Galvanized Steel Pipes\",\n  \"description\": \"Chinh Dai Company’s Galvanized Steel Pipes Products are manufactured based on Japanese, Korean and Chinese billets.\",\n  \"title_meta\": \"Galvanized Steel Pipes - Chinh Dai Steel\",\n  \"keyword\": \"Galvanized Steel Pipes - Chinh Dai Steel\"\n};\n\nvar makeShortcode = function makeShortcode(name) {\n  return function MDXDefaultShortcode(props) {\n    console.warn(\"Component \" + name + \" was not imported, exported, or provided by MDXProvider as global scope\");\n    return mdx(\"div\", props);\n  };\n};\n\nvar layoutProps = {\n  _frontmatter: _frontmatter\n};\nvar MDXLayout = \"wrapper\";\nreturn function MDXContent(_ref) {\n  var components = _ref.components,\n      props = _objectWithoutProperties(_ref, [\"components\"]);\n\n  return mdx(MDXLayout, _extends({}, layoutProps, props, {\n    components: components,\n    mdxType: \"MDXLayout\"\n  }), mdx(\"p\", {\n    style: {\n      \"marginTop\": \"0px\"\n    }\n  }, \" \", mdx(\"b\", null, \"GENERAL INTRODUCTION \")), mdx(\"p\", null, \"Chinh Dai Company\\u2019s Galvanized Steel Pipes Products are manufactured based on Japanese, Korean and Chinese billets. Zinc raw materials are imported from Australia, Korea and Brazil. The surface is specially treated with a chemical protective layer imported from India, so that the products have these following outstanding characteristics:\"), mdx(\"ul\", null, mdx(\"li\", {\n    parentName: \"ul\"\n  }, \"The surface is shiny and beautifully patterned.\")), mdx(\"ul\", null, mdx(\"li\", {\n    parentName: \"ul\"\n  }, \"High durability and perfect pressure resistance thanks to the thick Zinc layer (Z12 \\u2013 Z18), increased corrosion resistance and inner layer protected for a longer period.\")), mdx(\"div\", {\n    style: {\n      \"display\": \"flex\",\n      \"flexDirection\": \"column\"\n    }\n  }, mdx(\"img\", {\n    alt: \"Chinh Dai Steel\\u2019s Galvanized Steel Pipes\",\n    src: \"https://static.chinhdaisteel.com/products/galvanized-steel-pipes.webp?region=ap-southeast-1\",\n    style: {\n      \"maxWidth\": \"100%\",\n      \"margin\": \"auto\"\n    }\n  })), mdx(\"br\", null), mdx(\"p\", null, mdx(\"strong\", {\n    parentName: \"p\"\n  }, \"DETAILS\")), mdx(\"p\", null, \"Standard: ASTM A513-2007, ASTM A53-2007, JIS G3466\"), mdx(\"p\", null, \"Grade Group: A53-A369, Q195-Q345\"), mdx(\"p\", null, \"Grade: A369, Q235, Q345\"), mdx(\"p\", null, \"Thickness: 0.5 \\u2013 8 mm\"), mdx(\"p\", null, \"Section Shape: Square, Round, Rectangular\"), mdx(\"p\", null, \"Outer Diameter: 3-8mm\"), mdx(\"p\", null, \"Section Shape: Square, Round, Rectangular\"), mdx(\"p\", null, \"Application: Structure Pipe\"), mdx(\"p\", null, \"Technique: Hot Rolled\"), mdx(\"p\", null, \"Certification: JIS G3466\"), mdx(\"p\", null, \"Surface Treatment: Copper Coated\"), mdx(\"p\", null, \"Material: Q195/Q215/Q235/Q345\"), mdx(\"p\", null, \"Length: 1-12m\"), mdx(\"p\", null, \"Secondary Or Not: Non-secondary\"), mdx(\"p\", null, \"-\", \"-------------------------\"), mdx(\"p\", null, mdx(\"strong\", {\n    parentName: \"p\"\n  }, \"OUR SERVICES\")), mdx(\"ul\", null, mdx(\"li\", {\n    parentName: \"ul\"\n  }, \"Payment: Letter of Credit, T/T.\")), mdx(\"ul\", null, mdx(\"li\", {\n    parentName: \"ul\"\n  }, \"Delivery time: 30 \\u2013 60 days after receiving the deposit (depends on distance).\")), mdx(\"ul\", null, mdx(\"li\", {\n    parentName: \"ul\"\n  }, \"Packing: Steel pallet for Galvanized Steel Pipes.\")), mdx(\"ul\", null, mdx(\"li\", {\n    parentName: \"ul\"\n  }, \"Communication: 24/7 hotline, 24/7 email, fax, website. Your inquiry will be replied in 24 hours.\")), mdx(\"ul\", null, mdx(\"li\", {\n    parentName: \"ul\"\n  }, \"Consultancy: free 24/7 consultancy. Your private information and ideas of design will be protected.\")), mdx(\"br\", null));\n}\n;\nMDXContent.isMDXComponent = true;","frontmatter":{"feature_img":"https://static.chinhdaisteel.com/products/galvanized-steel-pipes.webp","category":" Galvanized Steel Pipes","slug":"/en/galvanized-steel-pipes","title":"Galvanized Steel Pipes","title_meta":"Galvanized Steel Pipes - Chinh Dai Steel","description":"Chinh Dai Company’s Galvanized Steel Pipes Products are manufactured based on Japanese, Korean and Chinese billets.","keyword":"Galvanized Steel Pipes - Chinh Dai Steel"}}},"pageContext":{"slug":"/en/galvanized-steel-pipes"}},"staticQueryHashes":[]}